{
  "format": "studio-png-layers",
  "version": 1,
  "name": "Original geometric breath",
  "width": 256,
  "height": 256,
  "license": "Original synthetic geometric sample; MIT. No repository character model is included.",
  "parameters": [
    {
      "id": "ParamBreath",
      "name": "Breath",
      "min": 0,
      "max": 1,
      "default": 0
    }
  ],
  "layers": [
    {
      "id": "body",
      "name": "SyntheticBody",
      "file": "original-geometric.png",
      "sha256": "d97ca08b120231d8fb8c0e455234c123c030c0f0a420ba20e9f61081aa01d002",
      "left": 0,
      "top": 0,
      "role": "torso.clothing",
      "opacity": 1,
      "bind": {
        "parameterId": "ParamBreath",
        "kind": "breath",
        "strength": 0.04
      }
    }
  ]
}
